{
  "projectId": "vietnam-brick-001",
  "slug": "vietnam-brick",
  "name": "Vietnam Brick Project",
  "location": "Vietnam",
  "summary": "A demonstration of how monitored brick-production efficiency data can be versioned and connected to an on-chain participation record.",
  "status": "active",
  "heroImage": "/images/vietnam-brick.jpg",
  "demonstrationNotice": "Demonstration data only. These figures are fictional examples and are not verified or issued carbon credits.",
  "currentVersion": 3,
  "snapshots": [
    {
      "projectId": "vietnam-brick-001",
      "dataType": "demonstration",
      "version": 1,
      "monitoringPeriod": { "start": "2026-05-01", "end": "2026-05-31" },
      "monitoredReduction": { "value": "120000.000", "unit": "tCO2e" },
      "projectProgress": "15.0",
      "forecastCreditVolume": { "type": "range", "min": "750000.000", "max": "800000.000", "unit": "tCO2e", "asOf": "2026-05-31T00:00:00.000Z", "basis": "Demonstration assumptions based on fictional sample monitoring data" },
      "targetIssuanceWindow": "2027-Q2..Q3",
      "methodology": "AMS-III.Z Energy Efficiency and Fuel Switching Measures for Brick Production (demonstration candidate)",
      "registry": "Verra VCS (demonstration candidate; registration not confirmed)",
      "verificationStage": "MONITORING",
      "verificationSourceStatus": "Demonstration initial monitoring",
      "measuredAt": "2026-05-31T00:00:00.000Z",
      "publishedAt": "2026-05-31T09:00:00.000Z",
      "sourceName": "EGOG demonstration seed",
      "sourceVersion": "vietnam-brick-seed-v1",
      "verificationNote": "Demonstration data; not verified or issued carbon credits."
    },
    {
      "projectId": "vietnam-brick-001",
      "dataType": "demonstration",
      "version": 2,
      "monitoringPeriod": { "start": "2026-05-01", "end": "2026-06-30" },
      "monitoredReduction": { "value": "240000.000", "unit": "tCO2e" },
      "projectProgress": "30.0",
      "forecastCreditVolume": { "type": "range", "min": "750000.000", "max": "800000.000", "unit": "tCO2e", "asOf": "2026-06-30T00:00:00.000Z", "basis": "Demonstration assumptions based on fictional sample monitoring data" },
      "targetIssuanceWindow": "2027-Q2..Q3",
      "methodology": "AMS-III.Z Energy Efficiency and Fuel Switching Measures for Brick Production (demonstration candidate)",
      "registry": "Verra VCS (demonstration candidate; registration not confirmed)",
      "verificationStage": "MONITORING",
      "verificationSourceStatus": "Demonstration monitoring update",
      "measuredAt": "2026-06-30T00:00:00.000Z",
      "publishedAt": "2026-06-30T09:00:00.000Z",
      "sourceName": "EGOG demonstration seed",
      "sourceVersion": "vietnam-brick-seed-v2",
      "verificationNote": "Demonstration data; not verified or issued carbon credits."
    },
    {
      "projectId": "vietnam-brick-001",
      "dataType": "demonstration",
      "version": 3,
      "monitoringPeriod": { "start": "2026-05-01", "end": "2026-07-20" },
      "monitoredReduction": { "value": "336000.000", "unit": "tCO2e" },
      "projectProgress": "42.0",
      "forecastCreditVolume": { "type": "range", "min": "750000.000", "max": "800000.000", "unit": "tCO2e", "asOf": "2026-07-20T00:00:00.000Z", "basis": "Demonstration assumptions based on fictional sample monitoring data" },
      "targetIssuanceWindow": "2027-Q2..Q3",
      "methodology": "AMS-III.Z Energy Efficiency and Fuel Switching Measures for Brick Production (demonstration candidate)",
      "registry": "Verra VCS (demonstration candidate; registration not confirmed)",
      "verificationStage": "VALIDATION",
      "verificationSourceStatus": "Demonstration validation preparation",
      "measuredAt": "2026-07-20T00:00:00.000Z",
      "publishedAt": "2026-07-20T09:00:00.000Z",
      "sourceName": "EGOG demonstration seed",
      "sourceVersion": "vietnam-brick-seed-v3",
      "verificationNote": "Demonstration data; not verified or issued carbon credits."
    }
  ]
}
